{
  "receipt_id": "pascal-coordinate-hbc-v1",
  "pascal_artifact_digest": "ac48f68fdec52ae0d78a1f533cfa4cc92005b11fdd62076200f5f779239fe630",
  "spatial_scene_digest": "9442daedbe96f88f07c0668ca88d6a93ed22ffa09152e380b79828e7c760b096",
  "pascal_frame_id": "pascal-site-frame",
  "aura_frame_id": "construction-hbc-local-frame",
  "transform_matrix": [
    1.0,
    0.0,
    0.0,
    0.0,
    0.0,
    1.0,
    0.0,
    0.0,
    0.0,
    0.0,
    1.0,
    0.0,
    0.0,
    0.0,
    0.0,
    1.0
  ],
  "source_unit_meters": 1.0,
  "destination_unit_meters": 1.0,
  "node_mapping_digest": "086df844bf08cb2b34369365045cbf3214c66b5d6472cb24d5c7bf1ebafac19b",
  "visual_alignment_only": true,
  "verified": true,
  "survey_authority": false,
  "construction_truth": false,
  "version": "AURA_PASCAL_COORDINATE_RECEIPT_V1",
  "receipt_digest": "f77f862ba001366ff650b8a9dcb12fb61c2abcfb757446fbc69daca9d278310d"
}
